{
  "$schema": "https://json-schema.org/draft/2020-12/schema",
  "$id": "https://ai-workforce.local/schemas/kontrollzustand-laufakte-payload.schema.json",
  "title": "Laufakte-Payload (LAUFAKTE_V0)",
  "description": "Beschreibt ausschließlich die Form von daten.daten — F2s registriereKernArtefakt-Parameter 'daten' (checkpoint.payload.daten.daten) —, wenn laufakte_schema === \"v0\" (F6a WS2). Die äußere Lineage-/Checkpoint-Hülle validiert weiterhin ausschließlich validiereLineageEintrag/validiereCheckpointEintrag aus F2/F1 (kein zweiter Regelsatz dafür). modell_beobachtet ist bewusst nullable geführt: das reale JSON-Feld für die Modellidentität aus der Claude-Code-Laufausgabe ist durch state/tp-nachtrag.md nicht belegt (Volltextsuche nach 'model': kein Treffer) — WS2 rät nicht, sondern lässt den Wert null (TECH_DEBT, Klärung folgt in WS3 mit echtem Nachweislauf). Trägt bewusst kein ergebnis-/permission_denials-Feld (F7-Grenze, AK12).",
  "type": "object",
  "additionalProperties": false,
  "required": [
    "laufakte_schema",
    "lauf_id",
    "werkzeug_version_deklariert",
    "berechtigungskontext",
    "arbeitsverzeichnis_pfad",
    "modell_beobachtet",
    "beobachtungsbasis_vollstaendig",
    "rohstrom_referenz",
    "erstellt_am"
  ],
  "properties": {
    "laufakte_schema": { "const": "v0" },
    "lauf_id": { "type": "string", "minLength": 1 },
    "werkzeug_version_deklariert": { "type": "string", "minLength": 1 },
    "berechtigungskontext": { "type": "string", "minLength": 1 },
    "arbeitsverzeichnis_pfad": { "type": "string", "minLength": 1 },
    "modell_beobachtet": {
      "oneOf": [
        { "type": "string", "minLength": 1 },
        { "type": "null" }
      ],
      "description": "Rang OBSERVED (E-185), nie als Zusicherung verwendet. null solange das reale Extraktionsfeld nicht belegt ist (siehe description oben)."
    },
    "beobachtungsbasis_vollstaendig": {
      "type": "boolean",
      "description": "false bei einem Lauf ohne valides \"type\":\"result\"-Ergebnisobjekt (Abbruch/Zeitüberschreitung, TP-01e-Muster) — rein deskriptiv, keine Klassifikation."
    },
    "rohstrom_referenz": {
      "type": "object",
      "additionalProperties": false,
      "required": ["pfad", "inhalts_hash"],
      "properties": {
        "pfad": { "type": "string", "minLength": 1 },
        "inhalts_hash": { "type": "string", "minLength": 64 }
      }
    },
    "erstellt_am": { "type": "string", "minLength": 1 },
    "worker": {
      "enum": ["claude-code", "codex"],
      "description": "F16 WS-1 (AK4). Welcher Worker den Lauf ausgeführt hat. Bewusst in properties und NICHT in required: die Feldliste ist über additionalProperties:false geschlossen, aber jede vor F16 geschriebene Laufakte ist append-only und trägt das Feld nicht — sie bliebe bei einer Pflichtangabe rückwirkend ungültig (dasselbe Muster wie freigabe_erteilt/F-207 und zeitgrenzeMs/F-177). Ein FEHLENDES worker bedeutet deshalb 'claude-code'; das ist kein Default im Schema, sondern die Lesart jedes Verbrauchers (laufakte.worker ?? 'claude-code')."
    },
    "modell_deklariert": {
      "type": "string",
      "minLength": 1,
      "description": "F16 WS-1 (AK4). Der dem Werkzeug im Argv übergebene Modellname, Rang DEKLARIERT (E-185) — nicht zu verwechseln mit modell_beobachtet (Rang OBSERVED, oben). Für einen Codex-Lauf bleibt modell_beobachtet null, weil der JSONL-Strom keine Modellkennung trägt (state/tp-m3-01-codex.md, Abschnitt 'Modellidentität': kein Feld gefunden) — erst dieses Feld macht den Lauf einem Modell zuordenbar. Optional aus demselben Append-only-Grund wie worker."
    },
    "verbrauch": {
      "type": "object",
      "additionalProperties": false,
      "required": ["input_tokens", "output_tokens", "cache_read_tokens", "cache_write_tokens", "dauer_ms", "dauer_api_ms", "turns", "quelle"],
      "description": "F32 WS-1 (§12 Kontingent-Nachbarschaft, §9.4 E-190). Rang OBSERVED, additiv und optional wie worker/modell_deklariert (append-only, Muster E-M2-5): fehlt die Beobachtungsbasis (kein 'type':'result'-Objekt bei claude-code, kein turn.completed-Ereignis mit usage bei codex), bleibt das gesamte Feld weg — nie geschätzt, nie teilweise befüllt.",
      "properties": {
        "input_tokens": { "type": "integer", "minimum": 0 },
        "output_tokens": { "type": "integer", "minimum": 0 },
        "cache_read_tokens": { "type": "integer", "minimum": 0 },
        "cache_write_tokens": { "type": "integer", "minimum": 0 },
        "dauer_ms": { "type": "integer", "minimum": 0 },
        "dauer_api_ms": { "oneOf": [{ "type": "integer", "minimum": 0 }, { "type": "null" }] },
        "turns": { "oneOf": [{ "type": "integer", "minimum": 0 }, { "type": "null" }] },
        "quelle": { "enum": ["claude-code", "codex"] }
      }
    },
    "beobachtung": {
      "type": "object",
      "additionalProperties": false,
      "required": ["init_tools", "init_agents", "init_skills", "init_mcp_server", "skill_aufrufe", "subagent_aufrufe", "mcp_aufrufe"],
      "description": "F36 WS-4 (AK8, F-730). Rang OBSERVED, reine Beobachtung aus dem stream-json-Rohstrom (state/spike-f36-werkzeugsatz.md): init-Zeile (tools, agents, skills, mcp_servers[].name) sowie Skill- (input.skill), Subagent- (Agent/Task, input.subagent_type) und MCP-Aufrufe (voller Werkzeugname mcp__…) in Reihenfolge des Auftretens, Duplikate erhalten, Subagent-Zeilen inbegriffen. Additiv und optional wie verbrauch (append-only): ohne init-Zeile (Codex, Abbruch vor init) fehlt das Feld ganz, statt leer gesetzt zu werden.",
      "properties": {
        "init_tools": { "type": "array", "items": { "type": "string" } },
        "init_agents": { "type": "array", "items": { "type": "string" } },
        "init_skills": { "type": "array", "items": { "type": "string" } },
        "init_mcp_server": { "type": "array", "items": { "type": "string" } },
        "skill_aufrufe": { "type": "array", "items": { "type": "string" } },
        "subagent_aufrufe": { "type": "array", "items": { "type": "string" } },
        "mcp_aufrufe": { "type": "array", "items": { "type": "string" } },
        "navigate_adressen": {
          "type": "array",
          "items": { "type": "string" },
          "description": "F36 WS-5a (E-F36-7). Optional (append-only: Laufakten vor WS-5a tragen das Feld nicht, daher nicht in required). input.url je Aufruf mcp__<server>__browser_navigate in Reihenfolge; ohne url der Platzhalter '(keine url)'. Erfasst nur den ausdrücklichen browser_navigate, keinen Seitenwechsel per Klick oder Weiterleitung. Zwilling von validiereLaufakteDaten (src/claude-code-gateway/index.ts)."
        },
        "hintergrund_aufrufe": {
          "type": "array",
          "items": { "type": "string" },
          "description": "F45 B1b-1 (F-1026). Optional (append-only: Laufakten vor B1b-1 tragen das Feld nicht). Werkzeugname je angenommenem Hintergrund-Aufruf (tool_use_result.backgroundTaskId oder input.run_in_background === true ohne Fehler), in Reihenfolge; Länge = Anzahl. Ein Wert > 0 macht den Lauf FEHLGESCHLAGEN (Grund hintergrund_ausfuehrung, nachgerechnet aus dem Rohstrom). Zwilling von validiereLaufakteDaten (src/claude-code-gateway/index.ts)."
        }
      }
    },
    "faehigkeiten_im_lauf": {
      "type": "object",
      "additionalProperties": false,
      "required": ["eintraege", "fremde_aufrufe"],
      "description": "F45 F-1 (F-815/F-816, Beleg 13). Optional (append-only): nur Läufe mit Katalog-Kontext. eintraege = beim Start eingefrorene Fähigkeiten (katalog: MCP/Ort-B-Skill; projekt: Agent/Skill im Arbeitsordner, hash nach Inhalt), am Ende mit den Aufrufen des Rohstroms verbunden (aufrufe/fehlgeschlagen; ohne init-Zeile null). fremde_aufrufe = Agent-/Skill-Aufrufe ohne passenden Eintrag (z. B. gesperrter eingebauter Agent). Zwilling von validiereLaufakteDaten (src/claude-code-gateway/index.ts).",
      "properties": {
        "eintraege": {
          "type": "array",
          "items": {
            "type": "object",
            "additionalProperties": false,
            "required": ["id", "name", "typ", "quelle", "aktiv", "aufrufe", "fehlgeschlagen"],
            "properties": {
              "id": { "type": "string", "minLength": 1 },
              "name": { "type": "string", "minLength": 1 },
              "typ": { "enum": ["mcp", "skill", "agent"] },
              "quelle": { "enum": ["katalog", "projekt"] },
              "hash": { "type": "string" },
              "pfad": { "type": "string" },
              "aktiv": { "type": "boolean" },
              "grund": { "type": "string" },
              "aufrufe": { "oneOf": [{ "type": "integer", "minimum": 0 }, { "type": "null" }] },
              "fehlgeschlagen": { "oneOf": [{ "type": "integer", "minimum": 0 }, { "type": "null" }] }
            }
          }
        },
        "fremde_aufrufe": {
          "type": "array",
          "items": {
            "type": "object",
            "additionalProperties": false,
            "required": ["art", "name", "fehler"],
            "properties": {
              "art": { "enum": ["agent", "skill"] },
              "name": { "type": "string" },
              "fehler": { "type": "boolean" }
            }
          }
        }
      }
    }
  }
}
